{
  "schema_version": "2.0",
  "deck": {
    "id": "deck-stage4",
    "title": "Stage 4 Resolver Fixture",
    "source_type": "article",
    "audience": "builders",
    "purpose": "delivery route tests",
    "language": "zh-CN",
    "presentation_context": "live",
    "aspect_ratio": "16:9",
    "production_profile": "premium",
    "target_builder": "pptxgenjs",
    "logical_slide_count": 5
  },
  "sources": [{"source_id": "src-001", "type": "article", "title": "Fixture"}],
  "style_contract_ref": "style-contract.json",
  "asset_manifest_ref": "asset-manifest.json",
  "slides": [
    {
      "id": "S01",
      "index": 1,
      "slide_role": "judgment",
      "title_role": "judgment",
      "title": "Native components stay editable",
      "judgment": "Ordinary components should stay native.",
      "message": "Metric card route test.",
      "audience_question": "What happens to KPI cards?",
      "source_refs": [{"source_id": "src-001", "locator": "s1", "claim_type": "direct"}],
      "primary_expression": "structured_cards",
      "supporting_expressions": [],
      "primary_anchor": "metric-card",
      "objects": [{"id": "metric-01", "type": "shape", "component_type": "metric_card", "semantic_role": "metric", "source_refs": [], "editability": "native_required", "complexity": {"node_count": 0}}],
      "delivery_contract": {"preferred_route": "native_ppt", "editable_core": ["number", "label"], "raster_allowance": [], "forbidden_raster": ["metric-01"]}
    },
    {
      "id": "S02",
      "index": 2,
      "slide_role": "data",
      "title_role": "judgment",
      "title": "Charts keep data editable",
      "judgment": "Simple charts should use native chart routes.",
      "message": "Chart route test.",
      "audience_question": "What happens to charts?",
      "source_refs": [{"source_id": "src-001", "locator": "s2", "claim_type": "direct"}],
      "primary_expression": "data_visual",
      "supporting_expressions": [],
      "primary_anchor": "bar-chart",
      "objects": [{"id": "chart-01", "type": "chart", "component_type": "bar_chart", "semantic_role": "chart", "source_refs": [], "editability": "native_required", "complexity": {"series_count": 2, "category_count": 6}}],
      "delivery_contract": {"preferred_route": "native_chart", "editable_core": ["data", "labels"], "raster_allowance": [], "forbidden_raster": ["chart-01"]}
    },
    {
      "id": "S03",
      "index": 3,
      "slide_role": "diagram",
      "title_role": "judgment",
      "title": "Simple diagrams stay native",
      "judgment": "Six-node diagrams are within native limits.",
      "message": "Diagram route test.",
      "audience_question": "What happens to simple diagrams?",
      "source_refs": [{"source_id": "src-001", "locator": "s3", "claim_type": "direct"}],
      "primary_expression": "relationship_visual",
      "supporting_expressions": [],
      "primary_anchor": "process-flow",
      "objects": [{"id": "diagram-01", "type": "diagram", "component_type": "process_flow", "semantic_role": "diagram", "source_refs": [], "diagram_ir_ref": "../diagrams/process-simple.json", "editability": "native_preferred", "complexity": {"node_count": 6, "edge_count": 6}}],
      "delivery_contract": {"preferred_route": "native_diagram", "editable_core": ["nodes", "labels"], "raster_allowance": [], "forbidden_raster": ["diagram-01"]}
    },
    {
      "id": "S04",
      "index": 4,
      "slide_role": "diagram",
      "title_role": "judgment",
      "title": "Complex diagrams can use hybrid overlay",
      "judgment": "A 14-node ecosystem map should fall back to hybrid overlay.",
      "message": "Complex diagram route test.",
      "audience_question": "What happens to complex diagrams?",
      "source_refs": [{"source_id": "src-001", "locator": "s4", "claim_type": "direct"}],
      "primary_expression": "relationship_visual",
      "supporting_expressions": [],
      "primary_anchor": "ecosystem",
      "objects": [{"id": "ecosystem-01", "type": "diagram", "component_type": "ecosystem_map", "semantic_role": "diagram", "source_refs": [], "diagram_ir_ref": "../diagrams/ecosystem-complex.json", "editability": "native_preferred", "complexity": {"node_count": 14, "edge_count": 16}}],
      "delivery_contract": {"preferred_route": "native_diagram", "editable_core": ["node_labels", "legend"], "raster_allowance": [], "forbidden_raster": []}
    },
    {
      "id": "S05",
      "index": 5,
      "slide_role": "cover",
      "title_role": "navigation",
      "title": "Concept scenes use generated image plus native overlay",
      "judgment": null,
      "message": "Concept scene route test.",
      "audience_question": "What happens to scenes?",
      "source_refs": [],
      "primary_expression": "conceptual_scene",
      "supporting_expressions": ["caption"],
      "primary_anchor": "scene",
      "objects": [{"id": "scene-01", "type": "image", "component_type": "conceptual_scene", "semantic_role": "scene", "source_refs": [], "editability": "raster_allowed", "complexity": {}}],
      "delivery_contract": {"preferred_route": "generated_image", "editable_core": ["title", "caption"], "raster_allowance": ["scene-01"], "forbidden_raster": ["title"]}
    }
  ]
}
